{
  "$schema": "https://json-schema.org/draft/2020-12/schema",
  "title": "skill-command-trajectory-eval-v1 row",
  "type": "object",
  "required": [
    "source_trace_id",
    "source_unit_id",
    "summary",
    "eval_task_type",
    "source_raw_row_id",
    "project_slug",
    "session_id",
    "command_name",
    "command_source",
    "command_intent",
    "command_intent_source",
    "expected_skill_name",
    "expected_trajectory_start_step",
    "expected_trajectory_end_step",
    "expected_excluded_steps_json",
    "expected_has_write_operations",
    "expected_write_operation_count",
    "expected_files_modified_json",
    "expected_tools_json",
    "label_confidence",
    "source_has_injected_body_args",
    "source_skill_body_mismatch",
    "limitations_json",
    "evidence_refs_json"
  ],
  "additionalProperties": false,
  "properties": {
    "source_trace_id": {"type": "string"},
    "source_unit_id": {"type": "string"},
    "summary": {"type": "string"},
    "eval_task_type": {"type": "string"},
    "source_raw_row_id": {"type": "string"},
    "project_slug": {"type": "string"},
    "session_id": {"type": "string"},
    "command_name": {"type": "string"},
    "command_source": {"type": "string"},
    "command_intent": {"type": "string"},
    "command_intent_source": {"type": "string"},
    "expected_skill_name": {"type": "string"},
    "expected_trajectory_start_step": {"type": "integer"},
    "expected_trajectory_end_step": {"type": "integer"},
    "expected_span_length_steps": {"type": "integer"},
    "expected_excluded_steps_json": {"type": "string"},
    "expected_has_write_operations": {"type": "boolean"},
    "expected_write_operation_count": {"type": "integer"},
    "expected_files_modified_count": {"type": "integer"},
    "expected_files_modified_json": {"type": "string"},
    "expected_tools_json": {"type": "string"},
    "expected_has_patch_refs": {"type": "boolean"},
    "outcome_success_label": {"type": "string"},
    "outcome_committed": {"type": "boolean"},
    "outcome_commit_sha": {"type": "string"},
    "label_confidence": {"type": "string"},
    "source_has_injected_body_args": {"type": "boolean"},
    "source_skill_body_name": {"type": "string"},
    "source_skill_body_mismatch": {"type": "boolean"},
    "limitations_json": {"type": "string"},
    "evidence_refs_json": {"type": "string"}
  }
}
