{
  "command_intent": "Research a library and write a compact brief.",
  "command_intent_source": "command_args",
  "command_name": "/scout-research",
  "command_source": "claude_slash_command",
  "eval_task_type": "command_trajectory_attribution",
  "evidence_refs_json": "{\"raw_dataset\": \"skill-command-trajectories\", \"raw_row_index\": 1, \"raw_row_key\": \"raw-row-000001\"}",
  "expected_excluded_steps_json": "[]",
  "expected_files_modified_count": 1,
  "expected_files_modified_json": "[\"kb/br/example.md\"]",
  "expected_has_patch_refs": false,
  "expected_has_write_operations": true,
  "expected_skill_name": "scout-research",
  "expected_span_length_steps": 6,
  "expected_tools_json": "[\"Read\", \"WebFetch\", \"Write\"]",
  "expected_trajectory_end_step": 6,
  "expected_trajectory_start_step": 1,
  "expected_write_operation_count": 1,
  "label_confidence": "high",
  "limitations_json": "[]",
  "outcome_commit_sha": "abc123",
  "outcome_committed": true,
  "outcome_success_label": "true",
  "project_slug": "example-project",
  "session_id": "",
  "source_has_injected_body_args": false,
  "source_raw_row_id": "raw-row-000001",
  "source_skill_body_mismatch": false,
  "source_skill_body_name": "",
  "source_trace_id": "raw:raw-row-000001",
  "source_unit_id": "raw-unit:raw-row-000001",
  "summary": "scout-research: Research a library and write a compact brief."
}
